Name,PAN No.,GSTIN No.,Permanent Address,Project ID
M/S. MANCHANDA AND MANCHANDA BUILDERS PRIVATE LIMITED,AAACM0825C PAN File,GSTN01234567891 GST Certificate,"HS-24, KAILASH COLONY MARKET, South Delhi, Delhi (110048) Address Proof",RERAHPKUP01180019
M/S SOMA NEW TOWNS PVT.LTD.,AALCS4814Q PAN File,GSTIN0123456789 GST Certificate,"B-4/45, Safdarjung Enclave, New Delhi, Delhi (110029) Address Proof",
VERENDER KUMAR & MINAKSHI SHARMA,ASTPK6959M PAN File,GST Certificate,"Ward No.5 Nagar Panchayat Gagret, TEHSIL GHANARI ,GAGRET KHAS (140), Una, Himachal Pradesh (177201)",
M/S. MAGIC RESORTS PVT. LTD.,AAHCM9235H PAN File,GSTIN0123456789 GST Certificate,"W-5/19, Western Avenue, Sainik Farms, New Delhi, Delhi (110062) Address Proof",
DAKSHAA INFRABUILD PRIVATE LIMITED,AACCD4272A PAN File,GSTIN0123456789 GST Certificate,"337, Lal Jyoti Apartment, Sector-9, Rohini, New Delhi, Delhi (110085) Address Proof",
M/S AMAR NATH AGGARWAL COLONISERS PVT. LTD.,AAGCA0315B PAN File,02AAGCA0315B1ZS GST Certificate,"3038-A,, GURU KASHI MARG, BATHINDA, Bathinda, Punjab (151001) Address Proof",
